{
  "receipt_id": "example-quarantine-001",
  "timestamp": "2026-09-23T00:00:00Z",
  "policy_hash": null,
  "objective_hash": null,
  "state_root": null,
  "program_ids": ["11111111111111111111111111111111"],
  "accounts": [],
  "simulation": { "status": "NOT_RUN" },
  "verdict": "QUARANTINE",
  "reason": "State root was not verified",
  "checkpoint": "VII",
  "scope": "LOCAL_PROTOCOL_RECEIPT"
}
